{
  "$schema": "https://json-schema.org/draft/2020-12/schema",
  "type": "object",
  "properties": {
    "id": {
      "type": "string"
    },
    "index_number": {
      "type": "string"
    },
    "title": {
      "type": "string"
    },
    "court": {
      "type": "string"
    },
    "claim_ids": {
      "type": "array",
      "items": {
        "type": "string"
      }
    },
    "event_ids": {
      "type": "array",
      "items": {
        "type": "string"
      }
    },
    "evidence_ids": {
      "type": "array",
      "items": {
        "type": "string"
      }
    }
  },
  "required": [
    "id",
    "index_number",
    "title",
    "court",
    "claim_ids",
    "event_ids",
    "evidence_ids"
  ],
  "additionalProperties": false
}